{
 "note": "Neighbouring inputs for the voice catalog's field rules (#1816). validate-contracts holds the schema's patterns to every row; the SessionKit host tests hold VoiceModelCatalogRules to the same rows. Add a row for any input that turns out to be misjudged.",
 "sha256": [
  {
   "value": "c3eb91414d5ff8a7a239b7fe9e34e7e2bf8a8140d8375ffb14718b1c639325db",
   "valid": true,
   "why": "64 lowercase hex"
  },
  {
   "value": "C3EB91414D5FF8A7A239B7FE9E34E7E2BF8A8140D8375FFB14718B1C639325DB",
   "valid": false,
   "why": "uppercase hex"
  },
  {
   "value": "c3eb91414d5ff8a7a239b7fe9e34e7e2BF8A8140D8375FFB14718B1C639325DB",
   "valid": false,
   "why": "mixed case"
  },
  {
   "value": "c3eb91414d5ff8a7a239b7fe9e34e7e2bf8a8140d8375ffb14718b1c639325d",
   "valid": false,
   "why": "63 characters"
  },
  {
   "value": "c3eb91414d5ff8a7a239b7fe9e34e7e2bf8a8140d8375ffb14718b1c639325db0",
   "valid": false,
   "why": "65 characters"
  },
  {
   "value": "c3eb91414d5ff8a7a239b7fe9e34e7e2bf8a8140d8375ffb14718b1c639325db ",
   "valid": false,
   "why": "trailing space"
  },
  {
   "value": "c3eb91414d5ff8a7a239b7fe9e34e7e2bf8a8140d8375ffb14718b1c639325db\n",
   "valid": false,
   "why": "trailing newline"
  },
  {
   "value": " c3eb91414d5ff8a7a239b7fe9e34e7e2bf8a8140d8375ffb14718b1c639325db",
   "valid": false,
   "why": "leading space"
  },
  {
   "value": "",
   "valid": false,
   "why": "empty"
  },
  {
   "value": "0xc3eb91414d5ff8a7a239b7fe9e34e7e2bf8a8140d8375ffb14718b1c639325",
   "valid": false,
   "why": "0x prefix"
  },
  {
   "value": "sha256:c3eb91414d5ff8a7a239b7fe9e34e7e2bf8a8140d8375ffb14718b1c639325db",
   "valid": false,
   "why": "algorithm prefix"
  },
  {
   "value": "c3eb91414dgff8a7a239b7fe9e34e7e2bf8a8140d8375ffb14718b1c639325db",
   "valid": false,
   "why": "non-hex letter"
  },
  {
   "value": "c3eb91414d\u0430ff8a7a239b7fe9e34e7e2bf8a8140d8375ffb14718b1c639325db",
   "valid": false,
   "why": "Cyrillic letter that looks like an ASCII one"
  }
 ],
 "httpsURL": [
  {
   "value": "https://huggingface.co/Supertone/supertonic-3/resolve/3cadd1e/onnx/tts.json",
   "valid": true,
   "why": "upstream file"
  },
  {
   "value": "https://mirror.example.net:8443/a/b.bin?x=1",
   "valid": true,
   "why": "port and query"
  },
  {
   "value": "https://EXAMPLE.org/a",
   "valid": true,
   "why": "uppercase host"
  },
  {
   "value": "https://example.org",
   "valid": true,
   "why": "no path"
  },
  {
   "value": "http://example.org/a",
   "valid": false,
   "why": "plain http"
  },
  {
   "value": "HTTPS://example.org/a",
   "valid": false,
   "why": "uppercase scheme"
  },
  {
   "value": "https://example.org/a ",
   "valid": false,
   "why": "trailing space"
  },
  {
   "value": "https://example.org/a\n",
   "valid": false,
   "why": "trailing newline"
  },
  {
   "value": " https://example.org/a",
   "valid": false,
   "why": "leading space"
  },
  {
   "value": "https://example.org/a b",
   "valid": false,
   "why": "space in path"
  },
  {
   "value": "",
   "valid": false,
   "why": "empty"
  },
  {
   "value": "https://",
   "valid": false,
   "why": "no host"
  },
  {
   "value": "https:///a",
   "valid": false,
   "why": "empty host"
  },
  {
   "value": "example.org/a",
   "valid": false,
   "why": "no scheme"
  },
  {
   "value": "//example.org/a",
   "valid": false,
   "why": "scheme-relative"
  },
  {
   "value": "ftp://example.org/a",
   "valid": false,
   "why": "ftp"
  },
  {
   "value": "file:///etc/passwd",
   "valid": false,
   "why": "file"
  },
  {
   "value": "javascript:alert(1)",
   "valid": false,
   "why": "javascript"
  },
  {
   "value": "https://user:pass@example.org/a",
   "valid": false,
   "why": "credentials"
  },
  {
   "value": "https://example.org@evil.example/a",
   "valid": false,
   "why": "credentials that look like a host"
  },
  {
   "value": "https://example.org/a#frag",
   "valid": false,
   "why": "fragment"
  },
  {
   "value": "https://example.org./a",
   "valid": false,
   "why": "trailing dot host"
  },
  {
   "value": "https://.example.org/a",
   "valid": false,
   "why": "leading dot host"
  },
  {
   "value": "https://exa mple.org/a",
   "valid": false,
   "why": "space in host"
  },
  {
   "value": "https://m\u00fcnchen.example/a",
   "valid": false,
   "why": "non-ASCII host"
  },
  {
   "value": "https://example.org:123456/a",
   "valid": false,
   "why": "port too long"
  },
  {
   "value": "https://example.org:80a/a",
   "valid": false,
   "why": "port not digits"
  },
  {
   "value": "https://example.org:/a",
   "valid": false,
   "why": "empty port"
  },
  {
   "value": "https://example.org/\u00e9",
   "valid": false,
   "why": "non-ASCII path"
  },
  {
   "value": "https://example.org/a\"b",
   "valid": false,
   "why": "double quote in path"
  },
  {
   "value": "https://example.org/<x>",
   "valid": false,
   "why": "angle brackets"
  },
  {
   "value": "https://example.org/a|b",
   "valid": false,
   "why": "pipe"
  },
  {
   "value": "https://example.org/%zz",
   "valid": false,
   "why": "bad percent escape"
  },
  {
   "value": "https://example.org/%4",
   "valid": false,
   "why": "truncated percent escape"
  },
  {
   "value": "https://example.org/a%20b",
   "valid": true,
   "why": "valid percent escape"
  },
  {
   "value": "https://example.org:99999/a",
   "valid": false,
   "why": "port above 65535"
  },
  {
   "value": "https://example.org:65535/a",
   "valid": true,
   "why": "highest port"
  },
  {
   "value": "https://example.org:0/a",
   "valid": false,
   "why": "port zero"
  },
  {
   "value": "https://example.org:080/a",
   "valid": false,
   "why": "port with leading zero"
  },
  {
   "value": "https://example.org/aaaaaaaaaaaaaaaaaaaaaaaaaaaaaaaaaaaaaaaaaaaaaaaaaaaaaaaaaaaaaaaaaaaaaaaaaaaaaaaaaaaaaaaaaaaaaaaaaaaaaaaaaaaaaaaaaaaaaaaaaaaaaaaaaaaaaaaaaaaaaaaaaaaaaaaaaaaaaaaaaaaaaaaaaaaaaaaaaaaaaaaaaaaaaaaaaaaaaaaaaaaaaaaaaaaaaaaaaaaaaaaaaaaaaaaaaaaaaaaaaaaaaaaaaaaaaaaaaaaaaaaaaaaaaaaaaaaaaaaaaaaaaaaaaaaaaaaaaaaaaaaaaaaaaaaaaaaaaaaaaaaaaaaaaaaaaaaaaaaaaaaaaaaaaaaaaaaaaaaaaaaaaaaaaaaaaaaaaaaaaaaaaaaaaaaaaaaaaaaaaaaaaaaaaaaaaaaaaaaaaaaaaaaaaaaaaaaaaaaaaaaaaaaaaaaaaaaaaaaaaaaaaaaaaaaaaaaaaaaaaaaaaaaaaaaaaaaaaaaaaaaaaaaaaaaaaaaaaaaaaaaaaaaaaaaaaaaaaaaaaaaaaaaaaaaaaaaaaaaaaaaaaaaaaaaaaaaaaaaaaaaaaaaaaaaaaaaaaaaaaaaaaaaaaaaaaaaaaaaaaaaaaaaaaaaaaaaaaaaaaaaaaaaaaaaaaaaaaaaaaaaaaaaaaaaaaaaaaaaaaaaaaaaaaaaaaaaaaaaaaaaaaaaaaaaaaaaaaaaaaaaaaaaaaaaaaaaaaaaaaaaaaaaaaaaaaaaaaaaaaaaaaaaaaaaaaaaaaaaaaaaaaaaaaaaaaaaaaaaaaaaaaaaaaaaaaaaaaaaaaaaaaaaaaaaaaaaaaaaaaaaaaaaaaaaaaaaaaaaaaaaaaaaaaaaaaaaaaaaaaaaaaaaaaaaaaaaaaaaaaaaaaaaaaaaaaaaaaaaaaaaaaaaaaaaaaaaaaaaaaaaaaaaaaaaaaaaaaaaaaaaaaaaaaaaaaaaaaaaaaaaaaaaaaaaaaaaaaaaaaaaaaaaaaaaaaaaaaaaaaaaaaaaaaaaaaaaaaaaaaaaaaaaaaaaaaaaaaaaaaaaaaaaaaaaaaaaaaaaaaaaaaaaaaaaaaaaaaaaaaaaaaaaaaaaaaaaaaaaaaaaaaaaaaaaaaaaaaaaaaaaaaaaaaaaaaaaaaaaaaaaaaaaaaaaaaaaaaaaaaaaaaaaaaaaaaaaaaaaaaaaaaaaaaaaaaaaaaaaaaaaaaaaaaaaaaaaaaaaaaaaaaaaaaaaaaaaaaaaaaaaaaaaaaaaaaaaaaaaaaaaaaaaaaaaaaaaaaaaaaaaaaaaaaaaaaaaaaaaaaaaaaaaaaaaaaaaaaaaaaaaaaaaaaaaaaaaaaaaaaaaaaaaaaaaaaaaaaaaaaaaaaaaaaaaaaaaaaaaaaaaaaaaaaaaaaaaaaaaaaaaaaaaaaaaaaaaaaaaaaaaaaaaaaaaaaaaaaaaaaaaaaaaaaaaaaaaaaaaaaaaaaaaaaaaaaaaaaaaaaaaaaaaaaaaaaaaaaaaaaaaaaaaaaaaaaaaaaaaaaaaaaaaaaaaaaaaaaaaaaaaaaaaaaaaaaaaaaaaaaaaaaaaaaaaaaaaaaaaaaaaaaaaaaaaaaaaaaaaaaaaaaaaaaaaaaaaaaaaaaaaaaaaaaaaaaaaaaaaaaaaaaaaaaaaaaaaaaaaaaaaaaaaaaaaaaaaaaaaaaaaaaaaaaaaaaaaaaaaaaaaaaaaaaaaaaaaaaaaaaaaaaaaaaaaaaaaaaaaaaaaaaaaaaaaaaaaaaaaaaaaaaaaaaaaaaaaaaaaaaaaaaaaaaaaaaaaaaaaaaaaaaaaaaaaaaaaaaaaaaaaaaaaaaaaaaaaaaaaaaaaaaaaaaaaaaaaaaaaaaaaaaaaaaaaaaaaaaaaaaaaaaaaaaaaaaaaaaaaaaaaaaaaaaaaaaaaaaaaaaaaaaaaaaaaaaaaaaaaaaaaaaaaaaaaaaaaaaaaaaaaaaaaaaaaaaaaaaaaaaaaaaaaaaaaaaaaaaaaaaaaaaaaaaaaaaaaaaaaa",
   "valid": false,
   "why": "over 2,048 characters"
  },
  {
   "value": "https://example.org/aaaaaaaaaaaaaaaaaaaaaaaaaaaaaaaaaaaaaaaaaaaaaaaaaaaaaaaaaaaaaaaaaaaaaaaaaaaaaaaaaaaaaaaaaaaaaaaaaaaaaaaaaaaaaaaaaaaaaaaaaaaaaaaaaaaaaaaaaaaaaaaaaaaaaaaaaaaaaaaaaaaaaaaaaaaaaaaaaaaaaaaaaaaaaaaaaaaaaaaaaaaaaaaaaaaaaaaaaaaaaaaaaaaaaaaaaaaaaaaaaaaaaaaaaaaaaaaaaaaaaaaaaaaaaaaaaaaaaaaaaaaaaaaaaaaaaaaaaaaaaaaaaaaaaaaaaaaaaaaaaaaaaaaaaaaaaaaaaaaaaaaaaaaaaaaaaaaaaaaaaaaaaaaaaaaaaaaaaaaaaaaaaaaaaaaaaaaaaaaaaaaaaaaaaaaaaaaaaaaaaaaaaaaaaaaaaaaaaaaaaaaaaaaaaaaaaaaaaaaaaaaaaaaaaaaaaaaaaaaaaaaaaaaaaaaaaaaaaaaaaaaaaaaaaaaaaaaaaaaaaaaaaaaaaaaaaaaaaaaaaaaaaaaaaaaaaaaaaaaaaaaaaaaaaaaaaaaaaaaaaaaaaaaaaaaaaaaaaaaaaaaaaaaaaaaaaaaaaaaaaaaaaaaaaaaaaaaaaaaaaaaaaaaaaaaaaaaaaaaaaaaaaaaaaaaaaaaaaaaaaaaaaaaaaaaaaaaaaaaaaaaaaaaaaaaaaaaaaaaaaaaaaaaaaaaaaaaaaaaaaaaaaaaaaaaaaaaaaaaaaaaaaaaaaaaaaaaaaaaaaaaaaaaaaaaaaaaaaaaaaaaaaaaaaaaaaaaaaaaaaaaaaaaaaaaaaaaaaaaaaaaaaaaaaaaaaaaaaaaaaaaaaaaaaaaaaaaaaaaaaaaaaaaaaaaaaaaaaaaaaaaaaaaaaaaaaaaaaaaaaaaaaaaaaaaaaaaaaaaaaaaaaaaaaaaaaaaaaaaaaaaaaaaaaaaaaaaaaaaaaaaaaaaaaaaaaaaaaaaaaaaaaaaaaaaaaaaaaaaaaaaaaaaaaaaaaaaaaaaaaaaaaaaaaaaaaaaaaaaaaaaaaaaaaaaaaaaaaaaaaaaaaaaaaaaaaaaaaaaaaaaaaaaaaaaaaaaaaaaaaaaaaaaaaaaaaaaaaaaaaaaaaaaaaaaaaaaaaaaaaaaaaaaaaaaaaaaaaaaaaaaaaaaaaaaaaaaaaaaaaaaaaaaaaaaaaaaaaaaaaaaaaaaaaaaaaaaaaaaaaaaaaaaaaaaaaaaaaaaaaaaaaaaaaaaaaaaaaaaaaaaaaaaaaaaaaaaaaaaaaaaaaaaaaaaaaaaaaaaaaaaaaaaaaaaaaaaaaaaaaaaaaaaaaaaaaaaaaaaaaaaaaaaaaaaaaaaaaaaaaaaaaaaaaaaaaaaaaaaaaaaaaaaaaaaaaaaaaaaaaaaaaaaaaaaaaaaaaaaaaaaaaaaaaaaaaaaaaaaaaaaaaaaaaaaaaaaaaaaaaaaaaaaaaaaaaaaaaaaaaaaaaaaaaaaaaaaaaaaaaaaaaaaaaaaaaaaaaaaaaaaaaaaaaaaaaaaaaaaaaaaaaaaaaaaaaaaaaaaaaaaaaaaaaaaaaaaaaaaaaaaaaaaaaaaaaaaaaaaaaaaaaaaaaaaaaaaaaaaaaaaaaaaaaaaaaaaaaaaaaaaaaaaaaaaaaaaaaaaaaaaaaaaaaaaaaaaaaaaaaaaaaaaaaaaaaaaaaaaaaaaaaaaaaaaaaaaaaaaaaaaaaaaaaaaaaaaaaaaaaaaaaaaaaaaaaaaaaaaaaaaaaaaaaaaaaaaaaaaaaaaaaaaaaaaaaaaaaaaaaaaaaaaaaaaaaaaaaaaaaaaaaaaaaaaaaaaaaaaaaaaaaaaaaaaaaaaaaaaaaaaaaaaaaaaaaaaaaaaaaaaaaaaaaaaaaaaaaaaaaaaaaaaaaaaaaaaaaaaaaaaaaaaaaaaaaaaaaaaaaaaaaaaaaaaaaaaaaaaaaaaaaaaaaaaaaaaaaaaa",
   "valid": true,
   "why": "under 2,048 characters"
  },
  {
   "value": "https://example.org/a?x=1&y=2",
   "valid": true,
   "why": "query"
  },